[
  {
    "is_number": "IS 14220",
    "title": "Openwell Submersible Pumpsets — Specification",
    "scope": "Covers requirements for openwell submersible pumpsets (monoset or motor and pump coupled) for handling clear, cold water up to 33°C, for agricultural and rural water supply purposes up to 45 kW.",
    "category": "Mechanical Engineering / Fluid Flow Systems",
    "product_types": [
      "Openwell Submersible Pumpset",
      "Submersible Monobloc Pump",
      "Agricultural Openwell Pump"
    ],
    "keywords": [
      "openwell",
      "submersible pump",
      "clear cold water",
      "overall efficiency",
      "head",
      "discharge",
      "motor rating"
    ],
    "status": "CURRENT",
    "current_version": "IS 14220:2018",
    "publication_year": 2018,
    "amendments": [
      {
        "amendment_number": "Amendment No. 1",
        "issue_date": "2020-03",
        "gazette_notification": null,
        "summary": "Updates to testing tolerances and cable gland specifications as per Product Manual PM/IS 14220.",
        "affected_clauses": ["Clause 7.2", "Clause 14.1"]
      }
    ],
    "supersedes": ["IS 14220:1994"],
    "superseded_by": null,
    "withdrawn_reason": null,
    "normative_references": [
      "IS 9283",
      "IS 5120",
      "IS 11346"
    ],
    "test_standards": [
      "IS 11346",
      "IS 9283"
    ],
    "safety_standards": [
      "IS 9283"
    ],
    "installation_standards": [
      "IS 14220"
    ],
    "related_standards": [
      "IS 8034",
      "IS 9079"
    ],
    "structured_parameters": [
      {
        "parameter_name": "Overall Efficiency",
        "governing_clause": "Clause 9.1, Table 1",
        "requirement_text": "Overall efficiency of the openwell pumpset shall not be less than the values specified in Table 1 corresponding to the rated head and discharge point. Tested strictly in accordance with IS 11346.",
        "min_value": null,
        "max_value": null,
        "unit": "%",
        "test_method_standard": "IS 11346",
        "test_method_clause": "Clause 8",
        "notes": "VERIFIED FACT: Efficiency is determined dynamically from Table 1 curves based on duty point (head H and discharge Q) and tested as per IS 11346. PENDING VERIFICATION: Numerical scalar cutoff (such as fixed 35%) is not universally valid across all ratings and must not be used as a hard regulatory rule without duty point inputs."
      },
      {
        "parameter_name": "Hydrostatic Test Pressure",
        "governing_clause": "Clause 13.1",
        "requirement_text": "Pump casing shall withstand hydrostatic test pressure of 1.5 times the maximum discharge pressure or 2.0 bar, whichever is higher, for a minimum duration of 2 minutes without leakage.",
        "min_value": 2.0,
        "max_value": null,
        "unit": "bar",
        "test_method_standard": "IS 5120",
        "test_method_clause": "Clause 11.2",
        "notes": "VERIFIED FACT: 1.5x max discharge pressure or 2.0 bar minimum for 2 minutes without leakage."
      },
      {
        "parameter_name": "Operating Voltage Range",
        "governing_clause": "Clause 6.2",
        "requirement_text": "Motor shall be capable of operating satisfactorily with supply voltage variation of +6% to -15% of rated voltage (415V for 3-phase, 240V for 1-phase).",
        "min_value": 352.0,
        "max_value": 440.0,
        "unit": "V",
        "test_method_standard": "IS 9283",
        "test_method_clause": "Clause 14",
        "notes": "VERIFIED FACT: Evaluated at rated frequency of 50 Hz ± 3%."
      },
      {
        "parameter_name": "Insulation Resistance",
        "governing_clause": "Clause 14.3",
        "requirement_text": "Insulation resistance between winding and motor frame shall not be less than 20 Megaohms when measured with 500V DC megger in dry condition and 5 Megaohms after immersion test.",
        "min_value": 5.0,
        "max_value": null,
        "unit": "MOhm",
        "test_method_standard": "IS 9283",
        "test_method_clause": "Clause 15.1",
        "notes": "VERIFIED FACT: Minimum 5 Megaohms post-immersion with 500V DC test voltage."
      }
    ],
    "certification": {
      "scheme": "Scheme I - ISI Mark (Product Certification)",
      "is_mandatory": false,
      "certification_body": "Bureau of Indian Standards",
      "applicable_provisions": "BIS Conformity Assessment Regulations 2018, Product Manual PM/IS 14220"
    },
    "qco": {
      "is_covered_by_qco": true,
      "qco_title": "Pumps (Quality Control) Order, 2023",
      "issuing_ministry": "Department for Promotion of Industry and Internal Trade (DPIIT)",
      "order_number": "S.O. 4333(E)",
      "gazette_date": "2023-10-06",
      "effective_date": "2024-10-06",
      "isi_mark_mandatory": true,
      "exemption_provisions": "VERIFIED FACT: Statutory exemption applies to goods manufactured domestically exclusively for export. PENDING VERIFICATION: Specific phased enforcement transition dates for Micro and Small Enterprises under subsequent DPIIT facilitation orders."
    },
    "source": {
      "portal_url": "https://www.bis.gov.in/wp-content/uploads/2024/07/PM-IS-14220.pdf",
      "gazette_citation": "Gazette of India Extraordinary Part II Sec 3(ii) S.O. 4333(E)",
      "official_publication_ref": "PM/IS 14220/3 July 2024",
      "curated_by": "HUMAN_CURATOR",
      "curator_notes": "Verified against BIS official Product Manual PM/IS 14220 and DPIIT Gazette notification S.O. 4333(E)."
    },
    "verification": {
      "verification_status": "VERIFIED_OFFICIAL",
      "verified_by": "Human Standards Specialist (SIH Human Engineering Team)",
      "verification_date": "2026-09-26T00:10:00Z",
      "verification_method": "BIS_OFFICIAL_PRODUCT_MANUAL_AUDIT"
    },
    "last_verified": "2026-09-26T00:10:00Z"
  },
  {
    "is_number": "IS 14220:1994",
    "title": "Openwell Submersible Pumpsets — Specification (First Edition)",
    "scope": "Original 1994 specification for openwell submersible pumpsets.",
    "category": "Mechanical Engineering / Fluid Flow Systems",
    "product_types": [
      "Openwell Submersible Pumpset"
    ],
    "keywords": [
      "openwell",
      "submersible pump",
      "superseded"
    ],
    "status": "SUPERSEDED",
    "current_version": "IS 14220:1994",
    "publication_year": 1994,
    "amendments": [],
    "supersedes": [],
    "superseded_by": "IS 14220:2018",
    "withdrawn_reason": null,
    "normative_references": [
      "IS 9283:1979",
      "IS 5120:1977"
    ],
    "test_standards": [
      "IS 11346"
    ],
    "safety_standards": [],
    "installation_standards": [],
    "related_standards": [],
    "structured_parameters": [
      {
        "parameter_name": "Overall Efficiency",
        "governing_clause": "Clause 8.1",
        "requirement_text": "Efficiency limits based on superseded 1994 baseline tables (lower than 2018 First Revision requirements).",
        "min_value": null,
        "max_value": null,
        "unit": "%",
        "test_method_standard": "IS 11346",
        "test_method_clause": "Clause 7",
        "notes": "Superseded baseline edition."
      }
    ],
    "certification": {
      "scheme": "Scheme I - ISI Mark (Obsolete Edition)",
      "is_mandatory": false,
      "certification_body": "Bureau of Indian Standards",
      "applicable_provisions": null
    },
    "qco": {
      "is_covered_by_qco": false,
      "qco_title": null,
      "issuing_ministry": null,
      "order_number": null,
      "gazette_date": null,
      "effective_date": null,
      "isi_mark_mandatory": false,
      "exemption_provisions": null
    },
    "source": {
      "portal_url": "https://www.bis.gov.in/wp-content/uploads/2024/07/PM-IS-14220.pdf",
      "gazette_citation": null,
      "official_publication_ref": "IS 14220:1994 (superseded by First Revision IS 14220:2018)",
      "curated_by": "HUMAN_CURATOR",
      "curator_notes": "VERIFIED FACT: Recorded to enable deterministic detection of obsolete tender citations."
    },
    "verification": {
      "verification_status": "VERIFIED_OFFICIAL",
      "verified_by": "Human Standards Specialist (SIH Human Engineering Team)",
      "verification_date": "2026-09-26T00:10:00Z",
      "verification_method": "BIS_PORTAL_REVISION_TRACKING"
    },
    "last_verified": "2026-09-26T00:10:00Z"
  },
  {
    "is_number": "IS 8034",
    "title": "Submersible Pumpsets — Specification",
    "scope": "Specifies requirements for deepwell / borehole submersible pumpsets (pumps directly driven by submersible motor) for clear, cold water.",
    "category": "Mechanical Engineering / Pumps",
    "product_types": [
      "Borehole Submersible Pumpset",
      "Deepwell Submersible Pumpset",
      "Multi-stage Submersible Pump"
    ],
    "keywords": [
      "submersible pump",
      "borehole",
      "deepwell",
      "clear cold water",
      "discharge",
      "multi-stage"
    ],
    "status": "CURRENT",
    "current_version": "IS 8034:2018",
    "publication_year": 2018,
    "amendments": [
      {
        "amendment_number": "Amendment No. 1",
        "issue_date": "2021-02",
        "gazette_notification": null,
        "summary": "Clarification on test tolerances and sampling criteria.",
        "affected_clauses": ["Clause 10.3"]
      }
    ],
    "supersedes": ["IS 8034:2002"],
    "superseded_by": null,
    "withdrawn_reason": null,
    "normative_references": [
      "IS 9283",
      "IS 5120",
      "IS 11346"
    ],
    "test_standards": [
      "IS 11346",
      "IS 9283"
    ],
    "safety_standards": [
      "IS 9283"
    ],
    "installation_standards": [
      "IS 8034"
    ],
    "related_standards": [
      "IS 14220",
      "IS 9079"
    ],
    "structured_parameters": [
      {
        "parameter_name": "Hydrostatic Casing Test",
        "governing_clause": "Clause 14.1",